{
  "source_directory": "https://www.imperial.ac.uk/study/courses/?courseType=undergraduate",
  "directory_listing_count": 73,
  "course_page_count": 73,
  "record_count": 116,
  "verification_date": "2026-10-26",
  "source_note": "Factual fields observed on Imperial College London's official 2027 course pages; no descriptions stored. Study options are separate records. Human review and BTS eligibility checks remain pending.",
  "records": [
    {
      "id": "imperial-aeronautical-engineering-meng",
      "source_url": "https://www.imperial.ac.uk/study/courses/undergraduate/2027/aeronautical-engineering/",
      "listing_number": 1,
      "option_index": 0,
      "title": "Aeronautical Engineering",
      "qualification": "MEng",
      "duration": "4 years",
      "start_date": "October 2027",
      "study_mode": "Full-time",
      "locations": [
        "South Kensington"
      ],
      "department": "Department of Aeronautics",
      "ucas_code": "H401",
      "minimum_entry_standard": [
        "A*A*A or A*AAA (A-levels)",
        "40 points (International Baccalaureate)"
      ],
      "overseas_fee": {
        "amount_gbp": 47800,
        "period": "year",
        "entry_year": 2027,
        "academic_year": null
      },
      "application_url": "https://www.ucas.com/dashboard#/"
    },
    {
      "id": "imperial-aeronautical-engineering-with-an-integrated-year-abroad-meng",
      "source_url": "https://www.imperial.ac.uk/study/courses/undergraduate/2027/aeronautical-engineering/",
      "listing_number": 1,
      "option_index": 1,
      "title": "Aeronautical Engineering with an Integrated Year Abroad",
      "qualification": "MEng",
      "duration": "4 years",
      "start_date": "October 2027",
      "study_mode": "Full-time",
      "locations": [
        "South Kensington"
      ],
      "department": "Department of Aeronautics",
      "ucas_code": null,
      "minimum_entry_standard": [
        "A*A*A or A*AAA (A-levels)",
        "40 points (International Baccalaureate)"
      ],
      "overseas_fee": null,
      "application_url": "https://www.ucas.com/dashboard#/"
    },
    {
      "id": "imperial-aeronautical-engineering-with-a-year-abroad-meng",
      "source_url": "https://www.imperial.ac.uk/study/courses/undergraduate/2027/aeronautical-engineering/",
      "listing_number": 1,
      "option_index": 2,
      "title": "Aeronautical Engineering with a Year Abroad",
      "qualification": "MEng",
      "duration": "5 years",
      "start_date": "October 2027",
      "study_mode": "Full-time",
      "locations": [
        "South Kensington"
      ],
      "department": "Department of Aeronautics",
      "ucas_code": null,
      "minimum_entry_standard": [
        "A*A*A or A*AAA (A-levels)",
        "40 points (International Baccalaureate)"
      ],
      "overseas_fee": null,
      "application_url": "https://www.ucas.com/dashboard#/"
    },
    {
      "id": "imperial-aeronautical-engineering-with-a-year-in-industry-meng",
      "source_url": "https://www.imperial.ac.uk/study/courses/undergraduate/2027/aeronautical-engineering/",
      "listing_number": 1,
      "option_index": 3,
      "title": "Aeronautical Engineering with a Year in Industry",
      "qualification": "MEng",
      "duration": "5 years",
      "start_date": "October 2027",
      "study_mode": "Full-time",
      "locations": [
        "South Kensington"
      ],
      "department": "Department of Aeronautics",
      "ucas_code": null,
      "minimum_entry_standard": [
        "A*A*A or A*AAA (A-levels)",
        "40 points (International Baccalaureate)"
      ],
      "overseas_fee": null,
      "application_url": "https://www.ucas.com/dashboard#/"
    },
    {
      "id": "imperial-aeronautics-with-spacecraft-engineering-meng",
      "source_url": "https://www.imperial.ac.uk/study/courses/undergraduate/2027/aeronautics-spacecraft-engineering/",
      "listing_number": 2,
      "option_index": 0,
      "title": "Aeronautics with Spacecraft Engineering",
      "qualification": "MEng",
      "duration": "4 years",
      "start_date": "October 2027",
      "study_mode": "Full-time",
      "locations": [
        "South Kensington"
      ],
      "department": "Department of Aeronautics",
      "ucas_code": null,
      "minimum_entry_standard": [
        "A*A*A or A*AAA (A-level)",
        "40 points (International Baccalaureate)"
      ],
      "overseas_fee": {
        "amount_gbp": 47800,
        "period": "year",
        "entry_year": 2027,
        "academic_year": null
      },
      "application_url": "https://www.ucas.com/dashboard#/"
    },
    {
      "id": "imperial-biochemistry-bsc",
      "source_url": "https://www.imperial.ac.uk/study/courses/undergraduate/2027/biochemistry-bsc/",
      "listing_number": 3,
      "option_index": 0,
      "title": "Biochemistry",
      "qualification": "BSc",
      "duration": "3 years",
      "start_date": "October 2027",
      "study_mode": "Full-time",
      "locations": [
        "South Kensington"
      ],
      "department": "Department of Life Sciences",
      "ucas_code": "C700",
      "minimum_entry_standard": [
        "AAA (A-level)",
        "38 points (International Baccalaureate)"
      ],
      "overseas_fee": {
        "amount_gbp": 47800,
        "period": "year",
        "entry_year": 2027,
        "academic_year": null
      },
      "application_url": "https://www.ucas.com/dashboard#/"
    },
    {
      "id": "imperial-biochemistry-with-research-abroad-bsc",
      "source_url": "https://www.imperial.ac.uk/study/courses/undergraduate/2027/biochemistry-bsc/",
      "listing_number": 3,
      "option_index": 1,
      "title": "Biochemistry with Research Abroad",
      "qualification": "BSc",
      "duration": "4 years",
      "start_date": "October 2027",
      "study_mode": "Full-time",
      "locations": [
        "South Kensington"
      ],
      "department": "Department of Life Sciences",
      "ucas_code": null,
      "minimum_entry_standard": [
        "AAA (A-level)",
        "38 points (International Baccalaureate)"
      ],
      "overseas_fee": null,
      "application_url": "https://www.ucas.com/dashboard#/"
    },
    {
      "id": "imperial-biochemistry-with-a-year-in-industry-research-bsc",
      "source_url": "https://www.imperial.ac.uk/study/courses/undergraduate/2027/biochemistry-bsc/",
      "listing_number": 3,
      "option_index": 2,
      "title": "Biochemistry with a Year in Industry/Research",
      "qualification": "BSc",
      "duration": "4 years",
      "start_date": "October 2027",
      "study_mode": "Full-time",
      "locations": [
        "South Kensington"
      ],
      "department": "Department of Life Sciences",
      "ucas_code": null,
      "minimum_entry_standard": [
        "AAA (A-level)",
        "38 points (International Baccalaureate)"
      ],
      "overseas_fee": null,
      "application_url": "https://www.ucas.com/dashboard#/"
    },
    {
      "id": "imperial-biochemistry-msci",
      "source_url": "https://www.imperial.ac.uk/study/courses/undergraduate/2027/biochemistry-msci/",
      "listing_number": 4,
      "option_index": 0,
      "title": "Biochemistry",
      "qualification": "MSci",
      "duration": "4 years",
      "start_date": "October 2027",
      "study_mode": "Full-time",
      "locations": [
        "South Kensington"
      ],
      "department": "Department of Life Sciences",
      "ucas_code": "C703",
      "minimum_entry_standard": [
        "AAA (A-level)",
        "38 points (International Baccalaureate)"
      ],
      "overseas_fee": {
        "amount_gbp": 47800,
        "period": "year",
        "entry_year": 2027,
        "academic_year": null
      },
      "application_url": "https://www.ucas.com/dashboard#/"
    },
    {
      "id": "imperial-biochemistry-with-language-for-science-bsc",
      "source_url": "https://www.imperial.ac.uk/study/courses/undergraduate/2027/biochemistry-language/",
      "listing_number": 5,
      "option_index": 0,
      "title": "Biochemistry with Language for Science",
      "qualification": "BSc",
      "duration": "4 years",
      "start_date": "October 2027",
      "study_mode": "Full-time",
      "locations": [
        "South Kensington"
      ],
      "department": "Department of Life Sciences",
      "ucas_code": null,
      "minimum_entry_standard": [
        "AAA (A-level)",
        "38 points (International Baccalaureate)"
      ],
      "overseas_fee": {
        "amount_gbp": 47800,
        "period": "year",
        "entry_year": 2027,
        "academic_year": null
      },
      "application_url": "https://www.ucas.com/dashboard#/"
    },
    {
      "id": "imperial-biochemistry-with-french-for-science-bsc",
      "source_url": "https://www.imperial.ac.uk/study/courses/undergraduate/2027/biochemistry-language/",
      "listing_number": 5,
      "option_index": 1,
      "title": "Biochemistry with French for Science",
      "qualification": "BSc",
      "duration": "4 years",
      "start_date": "October 2027",
      "study_mode": "Full-time",
      "locations": [
        "South Kensington"
      ],
      "department": "Department of Life Sciences",
      "ucas_code": "C7R1",
      "minimum_entry_standard": [
        "AAA (A-level)",
        "38 points (International Baccalaureate)"
      ],
      "overseas_fee": null,
      "application_url": "https://www.ucas.com/dashboard#/"
    },
    {
      "id": "imperial-biochemistry-with-german-for-science-bsc",
      "source_url": "https://www.imperial.ac.uk/study/courses/undergraduate/2027/biochemistry-language/",
      "listing_number": 5,
      "option_index": 2,
      "title": "Biochemistry with German for Science",
      "qualification": "BSc",
      "duration": "4 years",
      "start_date": "October 2027",
      "study_mode": "Full-time",
      "locations": [
        "South Kensington"
      ],
      "department": "Department of Life Sciences",
      "ucas_code": "C7R2",